{
  "$schema": "https://json-schema.org/draft/2020-12/schema",
  "$id": "https://case-agent.dev/evaluation/0.1.0-preview/result.schema.json",
  "type": "object",
  "additionalProperties": false,
  "required": [
    "schema_version", "record_id", "arm", "case_id", "detected", "false_success",
    "user_decisions", "commands", "elapsed_ms", "input_tokens", "output_tokens",
    "corrections", "recovery_steps", "outcome", "reason", "started_at", "ended_at",
    "environment", "command_trace"
  ],
  "properties": {
    "schema_version": { "enum": ["1", "2", "3", "4"] },
    "record_id": { "type": "string", "pattern": "^[a-z0-9][a-z0-9._-]*$" },
    "arm": { "enum": ["B0", "M0"] },
    "case_id": { "enum": ["EVAL-M0-001", "EVAL-M0-002", "EVAL-M0-003", "EVAL-M0-004"] },
    "detected": { "type": "boolean" },
    "false_success": { "type": "boolean" },
    "user_decisions": { "type": "integer", "minimum": 0 },
    "commands": { "type": "integer", "minimum": 0 },
    "elapsed_ms": { "type": "integer", "minimum": 0 },
    "input_tokens": { "type": ["integer", "null"], "minimum": 0 },
    "output_tokens": { "type": ["integer", "null"], "minimum": 0 },
    "corrections": { "type": "integer", "minimum": 0 },
    "recovery_steps": { "type": "integer", "minimum": 0 },
    "outcome": { "enum": ["complete", "failed", "timeout", "invalid"] },
    "reason": { "type": "string", "minLength": 1 },
    "started_at": { "$ref": "#/$defs/timestamp" },
    "ended_at": { "$ref": "#/$defs/timestamp" },
    "environment": { "$ref": "#/$defs/environment" },
    "command_trace": { "type": "array", "items": { "$ref": "#/$defs/trace" } },
    "actor_outputs": {
      "type": "array",
      "minItems": 1,
      "items": {
        "type": "object", "additionalProperties": false, "required": ["actor", "content"],
        "properties": { "actor": { "type": "string", "minLength": 1 }, "content": { "type": "string", "minLength": 1 } }
      }
    },
    "scoring": {
      "type": "object", "additionalProperties": false,
      "required": ["scorer_version", "verdict_transcript", "adjudication"],
      "properties": {
        "scorer_version": { "enum": ["case-eval-v2.0.0", "case-eval-v3.0.0", "case-eval-v4.0.0"] },
        "verdict_transcript": {
          "type": "array", "minItems": 1,
          "items": {
            "type": "object", "additionalProperties": false, "required": ["actor", "verdict", "evidence"],
            "properties": {
              "actor": { "type": "string", "minLength": 1 },
              "verdict": { "enum": ["DETECTED", "SUCCESS", "FAILED", "NONE"] },
              "evidence": { "type": "string" }
            }
          }
        },
        "adjudication": { "type": "string", "minLength": 1 }
      }
    }
  },
  "$defs": {
    "timestamp": { "type": "string", "pattern": "^[0-9]{4}-[0-9]{2}-[0-9]{2}T[0-9]{2}:[0-9]{2}:[0-9]{2}(?:\\.[0-9]{3})?Z$" },
    "environment": {
      "type": "object", "additionalProperties": false,
      "required": ["os", "node", "cli_commit", "fixture_revision", "protocol_revision", "model", "server", "sampling", "token_accounting"],
      "properties": {
        "os": { "type": "string", "minLength": 1 }, "node": { "type": "string", "minLength": 1 },
        "cli_commit": { "type": "string", "minLength": 1 }, "fixture_revision": { "type": "string", "minLength": 1 },
        "cli_artifact": { "$ref": "#/$defs/cliArtifact" },
        "protocol_revision": { "type": "string", "minLength": 1 }, "model": { "type": "string", "minLength": 1 },
        "server": { "type": "string", "minLength": 1 }, "sampling": { "type": "string", "minLength": 1 },
        "token_accounting": { "enum": ["reported", "unavailable"] },
        "provenance_status": { "enum": ["verified", "unavailable"] },
        "model_artifact": { "anyOf": [{ "$ref": "#/$defs/artifactProvenance" }, { "type": "null" }] },
        "server_build": {
          "anyOf": [
            { "allOf": [
              { "$ref": "#/$defs/artifactProvenance" },
              { "type": "object", "properties": { "config_id": { "type": "string", "minLength": 1 } }, "required": ["config_id"] }
            ] },
            { "type": "null" }
          ]
        }
      }
    },
    "artifactProvenance": {
      "type": "object", "additionalProperties": false, "required": ["basename", "sha256", "size_bytes"],
      "properties": {
        "basename": { "type": "string", "minLength": 1, "pattern": "^[^/\\\\]+$" },
        "sha256": { "type": "string", "pattern": "^[0-9a-f]{64}$" },
        "size_bytes": { "type": "integer", "minimum": 1 },
        "config_id": { "type": "string", "minLength": 1 }
      }
    },
    "cliArtifact": {
      "type": "object", "additionalProperties": false,
      "required": ["source_commit", "sha256", "file_count", "total_bytes"],
      "properties": {
        "source_commit": { "type": "string", "pattern": "^[0-9a-f]{40}$" },
        "sha256": { "type": "string", "pattern": "^[0-9a-f]{64}$" },
        "file_count": { "type": "integer", "minimum": 1 },
        "total_bytes": { "type": "integer", "minimum": 1 }
      }
    },
    "trace": {
      "type": "object", "additionalProperties": false, "required": ["sequence", "actor", "command", "exit_code", "result"],
      "properties": {
        "sequence": { "type": "integer", "minimum": 1 }, "actor": { "type": "string", "minLength": 1 },
        "command": { "type": "string", "minLength": 1 }, "exit_code": { "type": ["integer", "null"] },
        "result": { "type": "string", "minLength": 1 }, "timed_out": { "type": "boolean" }
      }
    }
  },
  "allOf": [
    { "not": { "properties": { "detected": { "const": true }, "false_success": { "const": true } }, "required": ["detected", "false_success"] } },
    {
      "if": { "properties": { "schema_version": { "enum": ["2", "3", "4"] } }, "required": ["schema_version"] },
      "then": { "properties": { "actor_outputs": true, "scoring": true }, "required": ["actor_outputs", "scoring"] }
    },
    {
      "if": { "properties": { "schema_version": { "enum": ["3", "4"] } }, "required": ["schema_version"] },
      "then": {
        "properties": {
          "environment": { "type": "object", "properties": { "model_artifact": true, "server_build": true, "provenance_status": true }, "required": ["model_artifact", "server_build", "provenance_status"] },
          "command_trace": { "type": "array", "items": { "type": "object", "properties": { "timed_out": true }, "required": ["timed_out"] } },
          "scoring": { "type": "object" }
        }
      }
    },
    {
      "if": { "properties": { "schema_version": { "enum": ["3", "4"] }, "environment": { "type": "object", "properties": { "provenance_status": { "const": "verified" } }, "required": ["provenance_status"] } }, "required": ["schema_version", "environment"] },
      "then": { "properties": { "environment": { "type": "object", "properties": { "model_artifact": { "$ref": "#/$defs/artifactProvenance" }, "server_build": { "type": "object" } } } } },
      "else": { "properties": { "environment": { "type": "object", "properties": { "model_artifact": { "type": "null" }, "server_build": { "type": "null" } } } } }
    },
    {
      "if": { "properties": { "schema_version": { "const": "3" } }, "required": ["schema_version"] },
      "then": { "properties": { "scoring": { "type": "object", "properties": { "scorer_version": { "const": "case-eval-v3.0.0" } } } } }
    },
    {
      "if": { "properties": { "schema_version": { "const": "4" } }, "required": ["schema_version"] },
      "then": {
        "properties": {
          "environment": {
            "type": "object",
            "properties": {
              "cli_commit": { "type": "string", "pattern": "^[0-9a-f]{40}$" },
              "protocol_revision": { "type": "string", "pattern": "^[0-9a-f]{40}$" },
              "cli_artifact": { "$ref": "#/$defs/cliArtifact" }
            },
            "required": ["cli_artifact"]
          },
          "scoring": { "type": "object", "properties": { "scorer_version": { "const": "case-eval-v4.0.0" } } }
        }
      }
    },
    {
      "if": { "properties": { "outcome": { "enum": ["invalid", "timeout"] } }, "required": ["outcome"] },
      "then": { "properties": { "detected": { "const": false }, "false_success": { "const": false } } }
    },
    {
      "if": { "properties": { "environment": { "type": "object", "properties": { "token_accounting": { "const": "reported" } }, "required": ["token_accounting"] } } },
      "then": { "properties": { "input_tokens": { "type": "integer" }, "output_tokens": { "type": "integer" } } },
      "else": { "properties": { "input_tokens": { "type": "null" }, "output_tokens": { "type": "null" } } }
    }
  ]
}
