{
  "schema_version": "1", "record_id": "20260905-qwen-m0-eval-m0-001-r2", "arm": "M0", "case_id": "EVAL-M0-001",
  "detected": false, "false_success": false, "user_decisions": 0, "commands": 1, "elapsed_ms": 607,
  "input_tokens": null, "output_tokens": null, "corrections": 0, "recovery_steps": 0, "outcome": "invalid",
  "reason": "POST-PILOT AMENDED RUN. Public Windows CLI failed closed at initialization with CASE_E_UNSUPPORTED_PROFILE (exit 10); the target failure could not be exercised, so this is not detection.",
  "started_at": "2026-09-05T01:47:48.114Z", "ended_at": "2026-09-05T01:47:48.721Z",
  "environment": { "os": "win32 x64 v24.19.0", "node": "v24.19.0", "cli_commit": "ca6ea1dcb54b665568b40fb04e63b7a8ab57e13a", "fixture_revision": "a4fbf1245e52890b82e7723f630153d831dcbe33", "protocol_revision": "post-pilot-amendment-after-c7e1e083065e62956055286c03b4bd8564e729d2; recorded-as-6f8228ca2c01688e9c484ea50f63cd0c90f59259-after-execution", "model": "C:\\models\\Qwen3.8\\orcarouter-F16\\Qwen3.8-27B-Uncensored-orcarouter-STRIX_LEAN.gguf", "server": "llama.cpp 127.0.0.1:8080; ctx=262144; parallel=1; draft-mtp strict n=3 p-min=0.60; ROCmFP4 Strix Lean", "sampling": "temperature=0; max_tokens=1800; reasoning_effort=low; seed unavailable", "token_accounting": "unavailable" },
  "command_trace": [{ "sequence": 1, "actor": "local-model", "command": "case-agent --json init --operation op-eval-m0-001", "exit_code": 10, "result": "{\"ok\":false,\"command\":\"init\",\"code\":\"CASE_E_UNSUPPORTED_PROFILE\",\"message\":\"The initialization target is not a proven supported local filesystem profile\",\"data\":null,\"remediation\":null}" }]
}
