{
  "schema_version": "1", "record_id": "20260905-qwen-b0-eval-m0-001-r2", "arm": "B0", "case_id": "EVAL-M0-001",
  "detected": false, "false_success": false, "user_decisions": 0, "commands": 2, "elapsed_ms": 58178,
  "input_tokens": 573, "output_tokens": 1479, "corrections": 0, "recovery_steps": 0, "outcome": "invalid",
  "reason": "POST-PILOT AMENDED RUN, INVALIDATED AFTER REVIEW: both commits branched from common basis a4fbf1245e52890b82e7723f630153d831dcbe33, but this run asked one post-hoc evaluator to inspect both writers rather than running two writer actors independently. Its FAILED conclusion is retained but receives no baseline credit; r3 corrects the actor topology without replacing this record.",
  "started_at": "2026-09-05T01:45:37.104Z", "ended_at": "2026-09-05T01:46:35.282Z",
  "environment": { "os": "win32 x64 v24.19.0", "node": "v24.19.0", "cli_commit": "ca6ea1dcb54b665568b40fb04e63b7a8ab57e13a", "fixture_revision": "a4fbf1245e52890b82e7723f630153d831dcbe33", "protocol_revision": "post-pilot-amendment-after-c7e1e083065e62956055286c03b4bd8564e729d2; recorded-as-6f8228ca2c01688e9c484ea50f63cd0c90f59259-after-execution", "model": "C:\\models\\Qwen3.8\\orcarouter-F16\\Qwen3.8-27B-Uncensored-orcarouter-STRIX_LEAN.gguf", "server": "llama.cpp 127.0.0.1:8080; ctx=262144; parallel=1; draft-mtp strict n=3 p-min=0.60; ROCmFP4 Strix Lean", "sampling": "temperature=0; max_tokens=1800; reasoning_effort=low; seed unavailable", "token_accounting": "reported" },
  "command_trace": [
    { "sequence": 1, "actor": "local-model", "command": "git log --all --graph --oneline --decorate", "exit_code": 0, "result": "* 3c30c81 (writer-a) writer A result\n| * ce0f9ee (HEAD -> writer-b) writer B result\n|/\n* a4fbf12 (master) fixture base" },
    { "sequence": 2, "actor": "local-model", "command": "read CASE.md", "exit_code": 0, "result": "common_basis: a4fbf1245e52890b82e7723f630153d831dcbe33; writer_a_claim: success on writer-a; writer_b_claim: success on writer-b; current artifact: v1, writer-b" }
  ]
}
